{
  "$schema": "https://appximo.com/schema/v1",
  "version": "1",
  "name": "createsec",
  "resources": {
    "records": {
      "fields": {
        "owner_id":    { "type": "uuid" },
        "title":       { "type": "string", "required": true, "maxLength": 80 },
        "secret_note": { "type": "text" },
        "status":      { "type": "string", "enum": ["open", "done"], "default": "open" }
      },
      "events": ["create"]
    }
  },
  "rbac": {
    "roles": {
      "admin": {
        "resources": "*",
        "actions": ["*"]
      },
      "owner": {
        "resources": ["records"],
        "actions": ["read", "create", "update"],
        "conditions": { "field": "owner_id", "op": "eq", "val": "$user_id" }
      },
      "limited": {
        "resources": ["records"],
        "actions": ["read", "create"],
        "fields": ["id", "title", "status"]
      }
    }
  }
}
